{
  "formatId": "loongbones.native-project",
  "formatVersion": 1,
  "minimumReaderVersion": 1,
  "appVersion": "0.1.0-dev",
  "project": {
    "id": "01J8Z000000000000000000000",
    "name": "minimal",
    "rootNodeId": "01J8Z000000000000000000002",
    "defaultSceneIndex": 0,
    "scenes": [
      {
        "id": "01J8Z000000000000000000001",
        "name": "Scene",
        "rootNodeId": "01J8Z000000000000000000002"
      }
    ],
    "nodes": [
      {
        "id": "01J8Z000000000000000000002",
        "name": "root",
        "type": "root",
        "parent": null,
        "children": [],
        "transform": {
          "x": 0.0,
          "y": 0.0,
          "rotationDeg": 0.0,
          "scaleX": 1.0,
          "scaleY": 1.0
        },
        "visible": true,
        "locked": false,
        "assetId": null,
        "regionId": null
      }
    ],
    "nodeOrder": [
      "01J8Z000000000000000000002"
    ],
    "assets": [],
    "textures": [],
    "atlases": []
  }
}
